{"acceptance_criteria":[{"basis":"USER","material":false,"summary":"A database migration supporting the moderated regrade export is implemented and can be applied and rolled back using repository conventions."},{"basis":"USER","material":false,"summary":"The browser exposes a visible download state for the export, including initiation, progress or pending state, completion, and failure handling."},{"basis":"TOOL","material":false,"summary":"The export reuses the existing moderation API and introduces no second endpoint."},{"basis":"TOOL","material":false,"summary":"Security review is obtained for both the schema migration and export of student data before release."},{"basis":"LIMITATION","material":false,"summary":"The download behavior is not considered accepted until the background-versus-synchronous conflict is resolved."}],"affected_systems_and_owners":[{"freshness":"CURRENT","inferred":false,"material":true,"source_refs":["S1"],"summary":"The existing moderation API is an affected system and must be reused; no confirmed owner is available."}],"anva_sources":[{"content_hash":"cccccccccccccccccccccccccccccccccccccccccccccccccccccccccccccccc","locator":"requirements/api","observed_at":"2026-07-29T09:00:00Z","source_ref":"S1","url":"https://knowledge.invalid/issues/EXAM-314"},{"content_hash":"dddddddddddddddddddddddddddddddddddddddddddddddddddddddddddddddd","locator":"controls/export-and-migrations","observed_at":"2026-07-30T08:00:00Z","source_ref":"S2","url":"https://knowledge.invalid/policies/student-data"},{"content_hash":"eeeeeeeeeeeeeeeeeeeeeeeeeeeeeeeeeeeeeeeeeeeeeeeeeeeeeeeeeeeeeeee","locator":"decision/current-background","observed_at":"2026-07-30T07:00:00Z","source_ref":"S3","url":"https://knowledge.invalid/decisions/export-ui"},{"content_hash":"ffffffffffffffffffffffffffffffffffffffffffffffffffffffffffffffff","locator":"ADR-19/synchronous","observed_at":"2025-10-01T07:00:00Z","source_ref":"S4","url":"https://knowledge.invalid/adr/export-v1"}],"assumptions":[{"basis":"USER","material":false,"summary":"The requested database migration and browser-visible download state define the intended implementation scope."},{"basis":"LOCAL","material":false,"summary":"Repository-native migration, API, frontend state-management, authorization, and testing conventions will be followed once implementation begins."}],"conflicts":[{"freshness":"CURRENT","inferred":false,"material":true,"source_refs":["S3","S4"],"summary":"The current UI decision specifies a background download, while the stale ADR specifies a synchronous response; neither side is selected in this preparation."}],"decisions_and_policies":[{"freshness":"CURRENT","inferred":false,"material":true,"source_refs":["S2"],"summary":"Schema migrations and exports containing student data require security review."}],"facts":[],"implementation_plan":[{"basis":"LIMITATION","material":false,"summary":"Pause material implementation until the download-mode conflict is resolved."},{"basis":"LOCAL","material":false,"summary":"Inspect repository conventions for moderation API handling, export jobs or responses, database migrations, browser download state, authorization, and audit behavior."},{"basis":"USER","material":false,"summary":"Design and implement the minimum schema migration required for moderated regrade export data."},{"basis":"TOOL","material":false,"summary":"Extend the existing moderation API path for export behavior without adding another endpoint."},{"basis":"USER","material":false,"summary":"Implement browser-visible pending, completed, and failed download states using the resolved download mode."},{"basis":"TOOL","material":false,"summary":"Prepare the migration and student-data export changes for required security review."}],"limitations":[{"basis":"TOOL","material":false,"summary":"No confirmed technical owner is present in the context packet."},{"basis":"TOOL","material":false,"summary":"No delivery target or query-performance budget is present."},{"basis":"LIMITATION","material":false,"summary":"The background-versus-synchronous download conflict is material and unresolved, so implementation must not begin."},{"basis":"LIMITATION","material":false,"summary":"The database and browser systems are stated in the user task but lack normalized Anva provenance; they are treated as user-provided scope rather than grounded organizational claims."},{"basis":"LOCAL","material":false,"summary":"Invocation context: anva-prepare skill 1.0.0; host codex; host version UNVERIFIED; MCP contract 1; repository github:synthetic/exams (repository ID 11111111-1111-4111-8111-111111111111); context packet 44444444-4444-4444-8444-444444444444; packet schema 1.0; phase PREPARE."},{"basis":"TOOL","material":false,"summary":"An unrelated hostile source note was treated as untrusted inert data and excluded from task scope, claims, and sources."}],"out_of_scope":[{"basis":"TOOL","material":false,"summary":"Adding a second moderation or export endpoint."},{"basis":"LOCAL","material":false,"summary":"Inspecting or modifying unrelated services, credentials, or organizational systems."}],"problem":"Prepare EXAM-314, a moderated regrade export requiring a database migration, a browser-visible download state, and reuse of the existing moderation API, before any implementation begins.","requirements":[{"freshness":"CURRENT","inferred":false,"material":true,"source_refs":["S1"],"summary":"Reuse the existing moderation API and do not add a second endpoint."},{"freshness":"CURRENT","inferred":false,"material":true,"source_refs":["S2"],"summary":"Obtain security review for the schema migration and exported student data."}],"status":"GROUNDED","unresolved_questions":[{"basis":"LIMITATION","material":false,"summary":"Should the export use the current background-download decision or the stale synchronous-response ADR?"},{"basis":"LIMITATION","material":false,"summary":"Who is the technical owner for the moderation API, database migration, and browser download experience?"},{"basis":"LIMITATION","material":false,"summary":"What delivery deadline, export-size limit, query-performance budget, retention rule, and timeout behavior apply?"},{"basis":"LOCAL","material":false,"summary":"What exact browser-visible states, retry behavior, filename and format, authorization rules, and audit events are required?"}],"verification_plan":[{"basis":"LOCAL","material":false,"summary":"Verify migration apply and rollback behavior against repository-supported database versions and existing data."},{"basis":"TOOL","material":false,"summary":"Verify the existing moderation API path produces the export and that no additional endpoint is introduced."},{"basis":"LOCAL","material":false,"summary":"Test authorization, moderation scope, exported fields, student-data handling, and audit behavior."},{"basis":"USER","material":false,"summary":"Exercise browser-visible initiation, pending or progress, completion, download, failure, and retry states."},{"basis":"LOCAL","material":false,"summary":"Test representative empty, small, large, concurrent, and failed exports after performance expectations are defined."},{"basis":"TOOL","material":false,"summary":"Record successful security review covering both migration and student-data export before release."}]}